{
  "messageId": "message-id-example",
  "type": "SessionEventStreamClosed",
  "version": "1.0.0",
  "occurredAt": "2026-09-08T12:00:00Z",
  "tenantId": "tenant-id-example",
  "regionId": "region-id-example",
  "clusterId": "cluster-id-example",
  "correlationId": "correlation-id-example",
  "data": {
    "sessionId": "session-id-example",
    "streamId": "stream-id-example",
    "source": "Core",
    "ownerEpoch": "1",
    "lastSequence": "1",
    "eventCount": "1",
    "closedAt": "2026-09-08T12:00:00Z",
    "streamDigest": "aaaaaaaaaaaaaaaaaaaaaaaaaaaaaaaaaaaaaaaaaaaaaaaaaaaaaaaaaaaaaaaa"
  },
  "aggregateId": "aggregate-id-example",
  "aggregateRevision": "1",
  "causationId": "causation-id-example"
}
